ticker,name,start_date,product_url,expense_ratio
IDNA,iShares Genomics Immunology and Healthcare ETF,2019-06-11,/us/products/308878/ishares-genomics-immunology-and-healthcare-etf-fund,0.47
TECB,iShares U.S. Tech Breakthrough Multisector ETF,2020-01-08,/us/products/312046/ishares-u-s-tech-breakthrough-multisector-etf-fund,0.40
STLG,iShares Factors US Growth Style ETF,2020-01-14,/us/products/312212/ishares-factors-us-growth-style-etf-fund,0.25
STLV,iShares Factors US Value Style ETF,2020-01-14,/us/products/312214/ishares-factors-us-value-style-etf-fund,0.25
LDEM,iShares ESG MSCI EM Leaders ETF,2020-02-05,/us/products/312222/ishares-esg-msci-em-leaders-etf-fund,0.16